{"$id":"https://vault-agent-memory.invalid/subject-distillation/implementation-progress.schema.json","$schema":"https://json-schema.org/draft/2020-12/schema","additionalProperties":false,"properties":{"baseline_full_digest":{"pattern":"^[0-9a-f]{64}$","type":"string"},"baseline_id":{"pattern":"^[0-9a-f]{16}$","type":"string"},"events":{"items":{"additionalProperties":false,"properties":{"at_utc":{"pattern":"^[0-9]{4}-[0-9]{2}-[0-9]{2}T[0-9]{2}:[0-9]{2}:[0-9]{2}Z$","type":"string"},"blocker":{"pattern":"^[A-Z][A-Z0-9_]{0,63}$","type":["string","null"]},"evidence_refs":{"items":{"oneOf":[{"additionalProperties":false,"properties":{"kind":{"const":"repo_file","type":"string"},"path":{"pattern":"^[A-Za-z0-9][A-Za-z0-9._/-]{0,255}$","type":"string"},"sha256":{"pattern":"^[0-9a-f]{64}$","type":"string"}},"required":["kind","path","sha256"],"type":"object"},{"additionalProperties":false,"properties":{"id":{"pattern":"^[A-Za-z0-9][A-Za-z0-9._:-]{0,127}$","type":"string"},"kind":{"const":"opaque","type":"string"}},"required":["kind","id"],"type":"object"}]},"maxItems":16,"minItems":0,"type":"array"},"from":{"enum":["BLOCKED","COMPLETED","IN_PROGRESS","PENDING"],"type":"string"},"sequence":{"maximum":4096,"minimum":1,"type":"integer"},"task_id":{"enum":["T-001","T-002","T-003","T-004","T-005","T-006","T-007","T-008","T-009","T-010","T-011","T-012","T-013","T-014","T-015","T-016","T-017","T-018","T-019","T-020","T-021","T-022","T-023","T-024","T-025","T-026","T-027","T-028","T-029","T-030","T-031","T-032","T-033"],"type":"string"},"to":{"enum":["BLOCKED","COMPLETED","IN_PROGRESS","PENDING"],"type":"string"}},"required":["sequence","task_id","from","to","at_utc","evidence_refs","blocker"],"type":"object"},"maxItems":4096,"minItems":1,"type":"array"},"schema_version":{"const":1,"type":"integer"},"tasks":{"additionalProperties":false,"properties":{"T-001":{"enum":["BLOCKED","COMPLETED","IN_PROGRESS","PENDING"],"type":"string"},"T-002":{"enum":["BLOCKED","COMPLETED","IN_PROGRESS","PENDING"],"type":"string"},"T-003":{"enum":["BLOCKED","COMPLETED","IN_PROGRESS","PENDING"],"type":"string"},"T-004":{"enum":["BLOCKED","COMPLETED","IN_PROGRESS","PENDING"],"type":"string"},"T-005":{"enum":["BLOCKED","COMPLETED","IN_PROGRESS","PENDING"],"type":"string"},"T-006":{"enum":["BLOCKED","COMPLETED","IN_PROGRESS","PENDING"],"type":"string"},"T-007":{"enum":["BLOCKED","COMPLETED","IN_PROGRESS","PENDING"],"type":"string"},"T-008":{"enum":["BLOCKED","COMPLETED","IN_PROGRESS","PENDING"],"type":"string"},"T-009":{"enum":["BLOCKED","COMPLETED","IN_PROGRESS","PENDING"],"type":"string"},"T-010":{"enum":["BLOCKED","COMPLETED","IN_PROGRESS","PENDING"],"type":"string"},"T-011":{"enum":["BLOCKED","COMPLETED","IN_PROGRESS","PENDING"],"type":"string"},"T-012":{"enum":["BLOCKED","COMPLETED","IN_PROGRESS","PENDING"],"type":"string"},"T-013":{"enum":["BLOCKED","COMPLETED","IN_PROGRESS","PENDING"],"type":"string"},"T-014":{"enum":["BLOCKED","COMPLETED","IN_PROGRESS","PENDING"],"type":"string"},"T-015":{"enum":["BLOCKED","COMPLETED","IN_PROGRESS","PENDING"],"type":"string"},"T-016":{"enum":["BLOCKED","COMPLETED","IN_PROGRESS","PENDING"],"type":"string"},"T-017":{"enum":["BLOCKED","COMPLETED","IN_PROGRESS","PENDING"],"type":"string"},"T-018":{"enum":["BLOCKED","COMPLETED","IN_PROGRESS","PENDING"],"type":"string"},"T-019":{"enum":["BLOCKED","COMPLETED","IN_PROGRESS","PENDING"],"type":"string"},"T-020":{"enum":["BLOCKED","COMPLETED","IN_PROGRESS","PENDING"],"type":"string"},"T-021":{"enum":["BLOCKED","COMPLETED","IN_PROGRESS","PENDING"],"type":"string"},"T-022":{"enum":["BLOCKED","COMPLETED","IN_PROGRESS","PENDING"],"type":"string"},"T-023":{"enum":["BLOCKED","COMPLETED","IN_PROGRESS","PENDING"],"type":"string"},"T-024":{"enum":["BLOCKED","COMPLETED","IN_PROGRESS","PENDING"],"type":"string"},"T-025":{"enum":["BLOCKED","COMPLETED","IN_PROGRESS","PENDING"],"type":"string"},"T-026":{"enum":["BLOCKED","COMPLETED","IN_PROGRESS","PENDING"],"type":"string"},"T-027":{"enum":["BLOCKED","COMPLETED","IN_PROGRESS","PENDING"],"type":"string"},"T-028":{"enum":["BLOCKED","COMPLETED","IN_PROGRESS","PENDING"],"type":"string"},"T-029":{"enum":["BLOCKED","COMPLETED","IN_PROGRESS","PENDING"],"type":"string"},"T-030":{"enum":["BLOCKED","COMPLETED","IN_PROGRESS","PENDING"],"type":"string"},"T-031":{"enum":["BLOCKED","COMPLETED","IN_PROGRESS","PENDING"],"type":"string"},"T-032":{"enum":["BLOCKED","COMPLETED","IN_PROGRESS","PENDING"],"type":"string"},"T-033":{"enum":["BLOCKED","COMPLETED","IN_PROGRESS","PENDING"],"type":"string"}},"required":["T-001","T-002","T-003","T-004","T-005","T-006","T-007","T-008","T-009","T-010","T-011","T-012","T-013","T-014","T-015","T-016","T-017","T-018","T-019","T-020","T-021","T-022","T-023","T-024","T-025","T-026","T-027","T-028","T-029","T-030","T-031","T-032","T-033"],"type":"object"},"tasks_sha256":{"pattern":"^[0-9a-f]{64}$","type":"string"},"updated_at_utc":{"pattern":"^[0-9]{4}-[0-9]{2}-[0-9]{2}T[0-9]{2}:[0-9]{2}:[0-9]{2}Z$","type":"string"}},"required":["schema_version","baseline_id","baseline_full_digest","tasks_sha256","updated_at_utc","tasks","events"],"type":"object"}
