{"baseline_full_digest":"0dc10cfc4a429662037f3bb7d6c42e10e7cc832b540f7aa8f4b9e0656e0e459b","baseline_id":"0dc10cfc4a429662","events":[{"at_utc":"2026-08-11T11:26:00Z","blocker":null,"evidence_refs":[],"from":"PENDING","sequence":1,"task_id":"T-001","to":"IN_PROGRESS"},{"at_utc":"2026-08-11T11:46:58Z","blocker":null,"evidence_refs":[{"id":"t001-authorization:468179c29ee4c98c59a973f81df73a1c173f95bcf9e793ce1cdbe29008e2e934","kind":"opaque"},{"id":"t001-review:59068c994b6e5cae60bee5a71ece8526d64bce7146d90849867684a91d96bc29","kind":"opaque"},{"kind":"repo_file","path":"scripts/read_subject_baseline_id.py","sha256":"88425b3ff6098ad4b44aeb683731c32839a5c1a9bd9a055138bc1eb61c7f5e1a"},{"kind":"repo_file","path":"scripts/update_subject_progress.py","sha256":"9afab898e882e42bc4033b05e88fe9358dc20bd835f3be4be18db61046647058"},{"kind":"repo_file","path":"scripts/validate_subject_evidence.py","sha256":"86707e63e5ab6aebb91440eec5b22a13dd98618237a799c1b82409067d1efcd7"},{"kind":"repo_file","path":"scripts/validate_subject_progress.py","sha256":"8cb33ef1f9b688be90fb093e0fd4437b245c2a9b2dbac3f3141c65005619416f"},{"kind":"repo_file","path":"specs/subject-distillation/evidence-schemas/attestation.schema.json","sha256":"b59a5292102a3796f11d39cf2d8dc00aec8b15c3da8d8d3ba8b396884d22f0c9"},{"kind":"repo_file","path":"specs/subject-distillation/evidence-schemas/backup-restore.schema.json","sha256":"f11149b63e04982974f81f9592c7230cb90233b5c0d7bf2447843aa420801dd7"},{"kind":"repo_file","path":"specs/subject-distillation/evidence-schemas/environment.schema.json","sha256":"59ab99ff33a2cc9aa0947b60f1529dfe04fb3a84c4cd0d4bc5f4f4a2434bb1c4"},{"kind":"repo_file","path":"specs/subject-distillation/evidence-schemas/fresh-review.schema.json","sha256":"3a77083430231728a0f05b572716fb1ea7c747576520f5fb0d453c63e96ac4c0"},{"kind":"repo_file","path":"specs/subject-distillation/evidence-schemas/migration.schema.json","sha256":"9fd9da33e7c0bdad098cede285298309620dc9f99626a3ed943da7300aa5f46b"},{"kind":"repo_file","path":"specs/subject-distillation/evidence-schemas/review-result.schema.json","sha256":"24c1d2e2b6ea72c64d5825c71d5fff143e8a3a643a390b7efdb43ed25e2db7de"},{"kind":"repo_file","path":"specs/subject-distillation/evidence/0dc10cfc4a429662/environment.json","sha256":"cf0feb64ac02e842773fc1669187fbd4fa49923e9e905094cbc622889ceb5fa8"},{"kind":"repo_file","path":"specs/subject-distillation/implementation-progress.schema.json","sha256":"06166f25313366d034d80abbb16fa49b8ac5b496a95712855c7f34a60819500a"},{"kind":"repo_file","path":"tests/test_subject_baseline_control.py","sha256":"77e11389e9ffdc205a26d7d835577476e9c2b6ba609b0af8bbc10508ae1e94b4"},{"kind":"repo_file","path":"tests/test_subject_progress.py","sha256":"6be4d93375205ee1f9ba414aa2704ee075ca583050238892d54030e7adadd3e6"}],"from":"IN_PROGRESS","sequence":2,"task_id":"T-001","to":"COMPLETED"},{"at_utc":"2026-08-12T07:14:30Z","blocker":null,"evidence_refs":[{"id":"t002-authorization:2257526802956bcb01d15a48725a1a1aa67b29131aa52856d9e39d3cb2a4e258","kind":"opaque"},{"kind":"repo_file","path":"specs/subject-distillation/task-authorizations/T-002.json","sha256":"10affc9a33337fb0931f07a6460ff5ee268493a65dca0e2618bf1226444cc82c"}],"from":"PENDING","sequence":3,"task_id":"T-002","to":"IN_PROGRESS"},{"at_utc":"2026-08-12T07:29:49Z","blocker":null,"evidence_refs":[{"id":"t002-authorization:2257526802956bcb01d15a48725a1a1aa67b29131aa52856d9e39d3cb2a4e258","kind":"opaque"},{"id":"t002-review:dc2669e64f2ee5eceb07c879cb3faca061dfc769f508d9987468aae555bbffea","kind":"opaque"},{"kind":"repo_file","path":"specs/subject-distillation/task-authorizations/T-002.json","sha256":"10affc9a33337fb0931f07a6460ff5ee268493a65dca0e2618bf1226444cc82c"},{"kind":"repo_file","path":"specs/subject-distillation/task-authorizations/T-002.review.json","sha256":"dc2669e64f2ee5eceb07c879cb3faca061dfc769f508d9987468aae555bbffea"},{"kind":"repo_file","path":"tests/fixtures/subject_distillation/fragments/failure-boundary-cases.json","sha256":"63b60d163a16eea156597d5deb748d7ab6883e0ec018a6529703e4730577245d"},{"kind":"repo_file","path":"tests/fixtures/subject_distillation/manifest.json","sha256":"99d31a8ba46be0ed9e53d0a98677c0bfa3d3b68566d2e426b9366a15a0c3790b"},{"kind":"repo_file","path":"tests/fixtures/subject_distillation/migration/migration-boundary-cases.json","sha256":"93e50a98a21eb4122675954404f5d4cb6f06bc0ad8f76499cd9c8131f325c9f1"},{"kind":"repo_file","path":"tests/fixtures/subject_distillation/organization/authority-boundary-cases.json","sha256":"53457c485c17de8226731128779c5c833c9058deca4a582ffea97c45faff3aa8"},{"kind":"repo_file","path":"tests/fixtures/subject_distillation/person/person-cases.json","sha256":"98cb60e31f460bd18f66a42a7688744907fe30f7a7c994d727e909bdfe20aac6"},{"kind":"repo_file","path":"tests/test_subject_fixture_privacy.py","sha256":"2717936249bd1c2ef88168785d1ecbc95f06dc5d0ac0964aff42bf20f057c271"}],"from":"IN_PROGRESS","sequence":4,"task_id":"T-002","to":"COMPLETED"},{"at_utc":"2026-08-12T12:24:56Z","blocker":null,"evidence_refs":[{"id":"t003-authorization:e62410d14f805c87de31bc6ac76908016aff548fc5a808007cc98c9a35c52168","kind":"opaque"},{"kind":"repo_file","path":"specs/subject-distillation/task-authorizations/T-003.json","sha256":"1fb2c069fc26c879963263cdedd473b2175b30a38659739ab51845a05509d2ff"}],"from":"PENDING","sequence":5,"task_id":"T-003","to":"IN_PROGRESS"},{"at_utc":"2026-08-12T13:59:27Z","blocker":null,"evidence_refs":[{"id":"t003-authorization:e62410d14f805c87de31bc6ac76908016aff548fc5a808007cc98c9a35c52168","kind":"opaque"},{"id":"t003-review:6b499942a711c87d2b3a54f3436fd319819c09a1b1932f04e2b4a1a57fceac5e","kind":"opaque"},{"kind":"repo_file","path":"scripts/export_subject_sbe_traceability.py","sha256":"b1533ca5f5a28cca97a34715e9cc58a38da13b0d38ec803ca76ab471bed30afd"},{"kind":"repo_file","path":"specs/subject-distillation/sbe-traceability.json","sha256":"6a0001edc05ffdce9e5d5f43a7a6b7e8e304325cdb9dd403dd4b4403c1dd2845"},{"kind":"repo_file","path":"specs/subject-distillation/task-authorizations/T-003.json","sha256":"1fb2c069fc26c879963263cdedd473b2175b30a38659739ab51845a05509d2ff"},{"kind":"repo_file","path":"specs/subject-distillation/task-authorizations/T-003.review.json","sha256":"6b499942a711c87d2b3a54f3436fd319819c09a1b1932f04e2b4a1a57fceac5e"},{"kind":"repo_file","path":"tests/test_subject_sbe_traceability.py","sha256":"551e058cad5439b9741b23d27f3e52377c9fee0fb51fa808b623c80cbb2f9038"}],"from":"IN_PROGRESS","sequence":6,"task_id":"T-003","to":"COMPLETED"}],"schema_version":1,"tasks":{"T-001":"COMPLETED","T-002":"COMPLETED","T-003":"COMPLETED","T-004":"PENDING","T-005":"PENDING","T-006":"PENDING","T-007":"PENDING","T-008":"PENDING","T-009":"PENDING","T-010":"PENDING","T-011":"PENDING","T-012":"PENDING","T-013":"PENDING","T-014":"PENDING","T-015":"PENDING","T-016":"PENDING","T-017":"PENDING","T-018":"PENDING","T-019":"PENDING","T-020":"PENDING","T-021":"PENDING","T-022":"PENDING","T-023":"PENDING","T-024":"PENDING","T-025":"PENDING","T-026":"PENDING","T-027":"PENDING","T-028":"PENDING","T-029":"PENDING","T-030":"PENDING","T-031":"PENDING","T-032":"PENDING","T-033":"PENDING"},"tasks_sha256":"0150935a1a16e51dc30dff9dff8d01104d7127ee3cf57333caec7586d93f5007","updated_at_utc":"2026-08-12T13:59:27Z"}
